duration,filename,language,language_probability,text
2.4613125,en01.wav,en,0.9824078679084778,All warfare is based on deception.
3.56425,en02.wav,en,0.9913200736045837,The supreme art of war is to subdue the enemy without fighting.
4.9923125,en03.wav,en,0.9368071556091309,"You know the enemy and know yourself, you need not fear the result of a hundred battles."
5.9326875,en04.wav,en,0.9952789545059204,"If you know yourself, but not the enemy. For every victory gained you will also suffer a defeat."
4.4930625,en05.wav,en,0.9746724367141724,"If you know neither the enemy nor yourself, you will succumb in every battle."
9.1370625,en06.wav,en,0.990517795085907,"Victorious warriors win first and then go to war, while defeated warriors go to war first and then seek to win."
